{
  "schema_version": 1,
  "name": "resource-lifecycle-check",
  "description": "Analyze creation, ownership, repetition, cancellation, shutdown, and cleanup for concurrent or long-running resources and define verification that exposes leaks.",
  "capabilities": ["concurrency-analysis", "resource-lifecycle-analysis", "cancellation-safety", "shutdown-verification", "resource-lifecycle-verification"],
  "when_to_use": ["background worker", "worker pool", "concurrency", "persistent worker", "long-running process", "subscription", "timer", "socket", "gpu resource"],
  "requires_tools": ["filesystem-read"],
  "procedure": "SKILL.md"
}
